{
  "schema_version": "agmind.prepared-temporary-egress-deny-plan.v1",
  "intent_id": "int_875f0f15c0ddb3aed2ad402b38423b6b",
  "verb": "temporary_egress_deny",
  "host_id": "123e4567-e89b-42d3-a456-426614174000",
  "docker_container_id": "aaaaaaaaaaaaaaaaaaaaaaaaaaaaaaaaaaaaaaaaaaaaaaaaaaaaaaaaaaaaaaaa",
  "docker_started_at": "2026-07-27T12:00:00Z",
  "image_id": "sha256:bbbbbbbbbbbbbbbbbbbbbbbbbbbbbbbbbbbbbbbbbbbbbbbbbbbbbbbbbbbbbbbb",
  "repo_digests": [],
  "immutable_spec_sha256": "cccccccccccccccccccccccccccccccccccccccccccccccccccccccccccccccc",
  "inventory_generation": 2,
  "inventory_revision": 1,
  "destination_ipv4": "1.1.1.1",
  "ttl_seconds": 120,
  "evidence_ids": [
    "evt_5ca264c47eb4ca4cf63114dba860fb95179167fcd0674d5d976a15c9e7473e98"
  ],
  "detector_bundle_sha256": "dddddddddddddddddddddddddddddddddddddddddddddddddddddddddddddddd",
  "policy_bundle_version": "pcc-v1",
  "policy_bundle_sha256": "eeeeeeeeeeeeeeeeeeeeeeeeeeeeeeeeeeeeeeeeeeeeeeeeeeeeeeeeeeeeeeee",
  "coverage_snapshot_sha256": "ffffffffffffffffffffffffffffffffffffffffffffffffffffffffffffffff",
  "created_at": "2026-07-27T12:00:00Z",
  "plan_id": "plan_e1a0cb9d0b196a0fae911f5e41a93058",
  "boot_id": "123e4567-e89b-42d3-a456-426614174001",
  "init_pid": 123,
  "pid_start_ticks": 456,
  "cgroup_path_sha256": "1111111111111111111111111111111111111111111111111111111111111111",
  "network_namespace_inode": 789,
  "docker_network_snapshot_sha256": "2222222222222222222222222222222222222222222222222222222222222222",
  "special_use_registry_sha256": "e3e39e76d00b1677335db8e9a805c7b9480ea2f4dc9e33f0b93cd3a905128d73",
  "management_denylist_sha256": "3333333333333333333333333333333333333333333333333333333333333333",
  "hard_limits_version": "pcc-hard-limits-v1",
  "prepared_at": "2026-07-27T12:00:02Z",
  "approval_expires_at": "2026-07-27T12:05:02Z",
  "nonce": "000102030405060708090a0b0c0d0e0f101112131415161718191a1b1c1d1e1f",
  "plan_hash": "f1a03c149c9129bc260563d45a8d61fda23e1e6abc438dd50c55aca712ebf42d"
}
